"poll.id","Title","Result","Ausschuss1","Ausschuss2","Ausschuss3","Label1","Label2","Label3"
1453,"Höhere Regionalisierungsmittel für den Bahnverkehr",FALSE,NA,NA,NA,"Verkehr",NA,NA
1234,"Verlängerung des Bundeswehreinsatzes im Libanon (UNIFIL) (2017)",TRUE,NA,NA,NA,"Außenpolitik und internationale Beziehungen",NA,NA
1233,"Verlängerung des Bundeswehreinsatzes im Mittelmeer (EUNAVFOR MED) (2017)",TRUE,NA,NA,NA,"Außenpolitik und internationale Beziehungen",NA,NA
1232,"Ehe für Alle",TRUE,NA,NA,NA,"Gesellschaftspolitik, soziale Gruppen",NA,NA
1231,"Ausschluss extremistischer Parteien von der Parteienfinanzierung",TRUE,NA,NA,NA,"Öffentliche Finanzen, Steuern und Abgaben","Finanzen","Politisches Leben, Parteien"
1230,"Verlängerung des Bundeswehreinsatzes im Kosovo (KFOR) (2017)",TRUE,NA,NA,NA,"Außenpolitik und internationale Beziehungen","Verteidigung",NA
1229,"Abschaffung der sachgrundlosen Befristung",FALSE,"Ausschuss für Arbeit und Soziales",NA,NA,"Arbeit und Beschäftigung","Recht",NA
1228,"Verlegung der Bundeswehr aus der Türkei nach Jordanien",TRUE,NA,NA,NA,"Außenpolitik und internationale Beziehungen","Verteidigung",NA
1227,"Rentenüberleitungsgesetz",TRUE,NA,NA,NA,"Senioren","Deutsche Einheit / Innerdeutsche Beziehungen (bis 1990)","Soziale Sicherung"
1226,"Vorläufiger Abschiebestopp nach Afghanistan",TRUE,NA,NA,NA,"Migration und Aufenthaltsrecht","Humanitäre Hilfe","Menschenrechte"
1225,"Neuregelung des bundesstaatlichen Finanzausgleichs",TRUE,NA,NA,NA,"Öffentliche Finanzen, Steuern und Abgaben","Finanzen","Haushalt"
1224,"Verlängerung des Bundeswehreinsatzes in Somalia (Atalanta) (2017)",TRUE,NA,NA,NA,"Außenpolitik und internationale Beziehungen",NA,NA
1223,"Verlängerung des Bundeswehreinsatzes in Mali (EUTM) (2017)",TRUE,NA,NA,NA,"Außenpolitik und internationale Beziehungen",NA,NA
1222,"Einführung eines Verbandsklagerechts im Lohngerechtigkeitsgesetz",FALSE,NA,NA,NA,"Arbeit und Beschäftigung","Frauen","Recht"
1221,"Bundeswehreinsatz in Somalia (EUTM) (2017)",TRUE,NA,NA,NA,"Verteidigung",NA,NA
1220,"Anpassung der PKW-Maut",TRUE,NA,NA,NA,"Öffentliche Finanzen, Steuern und Abgaben","Verkehr","Wirtschaft"
1219,"Keine Erhöhung der Verteidigungsausgaben auf 2 Prozent des BIP",FALSE,NA,NA,NA,"Öffentliche Finanzen, Steuern und Abgaben","Haushalt","Verteidigung"
1218,"Verbesserung der Mietpreisbremse",FALSE,NA,NA,NA,"Gesellschaftspolitik, soziale Gruppen","Raumordnung, Bau- und Wohnungswesen","Recht"
1217,"Schaffung einer zentralen Gesellschaft für Autobahnen und Bundesstraßen",TRUE,NA,NA,NA,"Verkehr","Wirtschaft",NA
1212,"Fortsetzung der Ausbildungsunterstützung im Irak (2017)",TRUE,NA,NA,NA,"Außenpolitik und internationale Beziehungen","Verteidigung",NA
1211,"Fortsetzung des Bundeswehreinsatzes in Mali",TRUE,NA,NA,NA,"Verteidigung",NA,NA
1210,"Angleichung der Rentenansprüche von DDR-Krankenschwestern",FALSE,NA,NA,NA,"Senioren","Deutsche Einheit / Innerdeutsche Beziehungen (bis 1990)","Soziale Sicherung"
1209,"Angleichung der Rentenansprüche von DDR-Bergleuten",FALSE,NA,NA,NA,"Senioren","Deutsche Einheit / Innerdeutsche Beziehungen (bis 1990)","Soziale Sicherung"
1208,"Verlängerung des Bundeswehreinsatz in Afghanistan (2016)",TRUE,NA,NA,NA,"Außenpolitik und internationale Beziehungen",NA,NA
1207,"Gesetz zur Bekämpfung der Schwarzarbeit",TRUE,NA,NA,NA,"Arbeit und Beschäftigung","Recht",NA
1206,"Verlängerung des Bundeswehreinsatzes in Darfur (2016)",TRUE,NA,NA,NA,"Außenpolitik und internationale Beziehungen",NA,NA
1205,"Verlängerung des Bundeswehreinsatzes in Südsudan (2016)",TRUE,NA,NA,NA,"Außenpolitik und internationale Beziehungen",NA,NA
1204,"Gesetzesentwurf zur Verantwortung für die kerntechnische Entsorgung",TRUE,NA,NA,NA,"Energie","Umwelt","Naturschutz"
1203,"Aktualisierung des Regelbedarfs und der Regelbedarfsstufen",TRUE,"Ausschuss für Arbeit und Soziales","Ausschuss für Familie, Senioren, Frauen und Jugend",NA,"Recht","Soziale Sicherung",NA
1202,"Anpassung des Seefischereigesetzes an das EU-Recht",TRUE,NA,NA,NA,"Umwelt","Naturschutz","Wirtschaft"
1201,"Haushalt 2017",TRUE,NA,NA,NA,"Finanzen",NA,NA
1200,"Einsatz deutscher Streitkräfte gegen den IS in Syrien (2016)",TRUE,NA,NA,NA,"Verteidigung",NA,NA
1199,"Arzneimittelreform",TRUE,NA,NA,NA,"Gesundheit","Wissenschaft, Forschung und Technologie","Forschung"
1198,"Privatisierung von Bundesliegenschaften stoppen",FALSE,NA,NA,NA,"Raumordnung, Bau- und Wohnungswesen",NA,NA
1197,"Mietrechtsreform 2016",FALSE,NA,NA,NA,"Raumordnung, Bau- und Wohnungswesen","Verbraucherschutz",NA
1196,"CETA weiterverfolgen",TRUE,NA,NA,NA,"Außenwirtschaft","Wirtschaft",NA
1195,"Bundeswehrbeteiligung an NATO-Operation SEA GUARDIAN (2016)",TRUE,NA,NA,NA,"Verteidigung",NA,NA
1194,"Antrag auf Verkauf des Dragoner-Areals",FALSE,NA,NA,NA,"Raumordnung, Bau- und Wohnungswesen",NA,NA
1167,"Reform des Erneuerbare-Energien-Gesetzes (EEG)",TRUE,NA,NA,NA,"Energie","Verbraucherschutz","Umwelt"
1166,"Reform des Sexualstrafrechts (Nein heißt Nein)",TRUE,NA,NA,NA,"Frauen","Menschenrechte",NA
1165,"Verlängerung des Bundeswehreinsatzes im Kosovo (KFOR) (2016)",TRUE,NA,NA,NA,"Außenpolitik und internationale Beziehungen",NA,NA
1164,"Erbschaftssteuerreform bzg. Firmenerbe",TRUE,NA,NA,NA,"Öffentliche Finanzen, Steuern und Abgaben","Wirtschaft",NA
1163,"Fracking-Neuregelung: Verbot von unkonventionellem Fracking",TRUE,NA,NA,NA,"Energie","Naturschutz","Wirtschaft"
1162,"Verlängerung des Bundeswehreinsatzes im Libanon (UNIFIL) (2016)",TRUE,NA,NA,NA,"Außenpolitik und internationale Beziehungen",NA,NA
1161,"Einstufung von Algerien, Marokko und Tunesien als sichere Herkunftsstaaten (2016)",TRUE,NA,NA,NA,"Migration und Aufenthaltsrecht",NA,NA
1160,"Verlängerung des Bundeswehreinsatzes in Somalia (Atalanta) (2016)",TRUE,NA,NA,NA,"Außenpolitik und internationale Beziehungen",NA,NA
1159,"Verlängerung des Bundeswehreinsatzes in Mali (2016)",TRUE,NA,NA,NA,"Außenpolitik und internationale Beziehungen",NA,NA
1158,"Grundsätzliches Fracking-Verbot",FALSE,NA,NA,NA,"Energie","Naturschutz","Wirtschaft"
1157,"Bekämpfung von Korruption im Gesundheitswesen",TRUE,NA,NA,NA,"Gesundheit","Recht","Wirtschaft"
1156,"Verlängerung des Bundeswehreinsatzes in Somalia (EUTM) (2016)",TRUE,NA,NA,NA,"Außenpolitik und internationale Beziehungen",NA,NA
1155,"Neuzulassung von Glyphosat verhindern",FALSE,NA,NA,NA,"Verbraucherschutz","Umwelt","Naturschutz"
1154,"Verschärfung des Asylrechts (Asylpaket II)",TRUE,NA,NA,NA,"Außenpolitik und internationale Beziehungen","Migration und Aufenthaltsrecht","Menschenrechte"
1153,"Verlängerung des Bundeswehreinsatzes in Nord-Irak (2016)",TRUE,NA,NA,NA,"Außenpolitik und internationale Beziehungen",NA,NA
1152,"2016: Verlängerung des Bundeswehreinsatzes in Mali (MINUSMA)",TRUE,NA,NA,NA,"Humanitäre Hilfe","Verteidigung",NA
1151,"Verlängerung des Bundeswehreinsatzes im Mittelmeer (OAE) (2016)",TRUE,NA,NA,NA,"Außenpolitik und internationale Beziehungen",NA,NA
1150,"Umsetzung Aktionsprogramm Klimaschutz 2020",FALSE,NA,NA,NA,"Umwelt",NA,NA
1149,"Bundeswehreinsatz gegen den IS in Syrien (2015)",TRUE,NA,NA,NA,"Verteidigung",NA,NA
1148,"Verlängerung Bundeswehr-Einsatz in Darfur (UNAMID) (2015)",TRUE,NA,NA,NA,"Außenpolitik und internationale Beziehungen",NA,NA
1147,"Verlängerung des Bundeswehreinsatzes im Südsudan (UNMISS) (2016)",TRUE,NA,NA,NA,"Außenpolitik und internationale Beziehungen",NA,NA
1146,"Verlängerung des Afghanistan-Einsatzes der Bundeswehr (2016)",TRUE,NA,NA,NA,"Außenpolitik und internationale Beziehungen",NA,NA
1145,"Wiedereinführung der Vorratsdatenspeicherung (2015)",TRUE,NA,NA,NA,"Innere Sicherheit",NA,NA
1144,"Verschärfung des Asylrechts (Asylpaket I)",TRUE,NA,NA,NA,"Außenpolitik und internationale Beziehungen","Migration und Aufenthaltsrecht","Menschenrechte"
1143,"Bundeswehreinsatz zur Bekämpfung von Menschenschmuggel im Mittelmeer (EUNAFOR MED) (2015)",TRUE,NA,NA,NA,"Verteidigung",NA,NA
1142,"Verbot von geschäftsmäßiger Sterbehilfe",TRUE,NA,NA,NA,"Gesundheit",NA,NA
1106,"Gewährung eines 86 Mrd. Euro Kreditpakets für Griechenland",TRUE,NA,NA,NA,"Außenpolitik und internationale Beziehungen","Europapolitik und Europäische Union","Finanzen"
1105,"Neubausubventionen für Atomkraftwerke in der EU verhindern",FALSE,NA,NA,NA,"Energie","Umwelt",NA
1104,"Neubestimmung Bleiberecht und Aufenthaltsbeendigung für Flüchtlinge (Entschließungsantrag Die Linke)",FALSE,NA,NA,NA,"Migration und Aufenthaltsrecht","Familie",NA
1103,"Verhandlungsmandat für Griechenland-Finanzhilfen",TRUE,NA,NA,NA,"Europapolitik und Europäische Union","Geschäftsordnung",NA
1080,"Bundeshaushaltsplan 2015",TRUE,NA,NA,NA,"Öffentliche Finanzen, Steuern und Abgaben","Haushalt",NA
1079,"Fortsetzung des Bundeswehreinsatzes im Südsudan (2014)",TRUE,NA,NA,NA,"Verteidigung",NA,NA
1076,"BAföG-Reform zur Erhöhung der Bedarfssätze",TRUE,NA,NA,NA,"Bildung und Erziehung","Öffentliche Finanzen, Steuern und Abgaben","Soziale Sicherung"
1078,"Lockerung des Kooperationsverbotes von Bund und Ländern bei der Hochschulfinanzierung",TRUE,NA,NA,NA,"Bildung und Erziehung","Haushalt","Politisches Leben, Parteien"
1077,"Verlängerung des Bundeswehreinsatzes in Darfur (UNAMID) (2014)",TRUE,NA,NA,NA,"Außenpolitik und internationale Beziehungen",NA,NA
1069,"Länderöffnungsklausel zur Regelungen über Mindestabstände zwischen Windenergieanlagen und Wohnbebauungen",TRUE,NA,NA,NA,"Energie","Raumordnung, Bau- und Wohnungswesen",NA
1054,"Reform zur Reduzierung der Kosten der EEG-Umlage",TRUE,NA,NA,NA,"Verbraucherschutz","Umwelt",NA
1049,"2014: Verlängerung des Bundeswehreinsatzes im Kosovo (KFOR)",TRUE,"Ausschuss für Menschenrechte und humanitäre Hilfe","Verteidigungsausschuss",NA,"Außenpolitik und internationale Beziehungen","Verteidigung",NA
1048,"Änderungsantrag zum Gesetz zur Sukzessivadoption durch Lebenspartner",FALSE,"Ausschuss für Familie, Senioren, Frauen und Jugend","Ausschuss für Recht und Verbraucherschutz",NA,"Gesellschaftspolitik, soziale Gruppen","Familie","Recht"
1047,"Verlängerung des Bundeswehreinsatzes gegen Piraterie (Operation Atalanta) (2014)",TRUE,NA,NA,NA,"Außenpolitik und internationale Beziehungen",NA,NA
1044,"Transparenz bei Rüstungsexportentscheidungen",FALSE,NA,NA,NA,"Lobbyismus & Transparenz","Wirtschaft",NA
1038,"Rechte der parlamentarischen Minderheit stärken",TRUE,NA,NA,NA,"Gesellschaftspolitik, soziale Gruppen","Bundestag",NA
1020,"Kennzeichnungspflicht von Gen-Honig",FALSE,NA,NA,NA,"Verbraucherschutz","Umwelt",NA
1011,"Fortsetzung des Afghanistan-Einsatzes (ISAF) (2014)",TRUE,NA,NA,NA,"Verteidigung",NA,NA
1005,"Verlängerung des Darfur-Einsatzes (UNAMID) (2013)",TRUE,NA,NA,NA,"Außenpolitik und internationale Beziehungen","Entwicklungspolitik","Menschenrechte"
1097,"Verlängerung des Bundeswehreinsatzes in Mali (MINUSMA) (2015)",TRUE,NA,NA,NA,"Außenpolitik und internationale Beziehungen",NA,NA
1096,"Rückwirkende Erhöhung von Kinderfreibetrag und Kindergeld",FALSE,NA,NA,NA,"Familie","Jugend",NA
1095,"Verlängerung des Bundeswehreinsatzes in Kosovo (KFOR) (2015)",TRUE,NA,NA,NA,"Außenpolitik und internationale Beziehungen",NA,NA
1094,"Verlängerung Bundeswehreinsatz Libanon (UNIFIL) (2015)",TRUE,NA,NA,NA,"Außenpolitik und internationale Beziehungen",NA,NA
1093,"Beschluss des Tarifeinheitsgesetzes",TRUE,NA,NA,NA,"Arbeit und Beschäftigung",NA,NA
1092,"Verlängerung Bundeswehreinsatz Somalia (Operation Atalanta) (2015)",TRUE,NA,NA,NA,"Verteidigung",NA,NA
1091,"Verlängerung Bundeswehreinsatz Liberia (2015)",TRUE,NA,NA,NA,"Außenpolitik und internationale Beziehungen",NA,NA
1090,"Private- und kommunale Holzvermarktung auf Landesebene erlauben",FALSE,NA,NA,NA,"Umwelt","Naturschutz",NA
1089,"Für eine nachhaltigere Liegenschaftspolitik des Bundes",FALSE,NA,NA,NA,"Raumordnung, Bau- und Wohnungswesen","Soziale Sicherung","Naturschutz"
1088,"PKW-Maut",TRUE,NA,NA,NA,"Finanzen","Verkehr",NA
1087,"Verlängerung des Bundeswehreinsatzes in Mali (EUTM Mali) (2015)",TRUE,NA,NA,NA,"Außenpolitik und internationale Beziehungen",NA,NA
1086,"Finanzhilfen für Griechenland 2015",TRUE,NA,NA,NA,"Außenpolitik und internationale Beziehungen","Europapolitik und Europäische Union","Finanzen"
1085,"Ausbildungsunterstützungseinsatz Kurdistan-Irak (2015)",TRUE,NA,NA,NA,"Außenpolitik und internationale Beziehungen","Verteidigung",NA
1084,"Bundeswehreinsatz zur Luftüberwachung in der Türkei (2015)",TRUE,NA,NA,NA,"Verteidigung",NA,NA
1083,"Fortsetzung des Bundeswehreinsatzes im Mittelmeer (ACTIVE ENDEAVOUR) (2014)",TRUE,NA,NA,NA,"Verteidigung",NA,NA
1082,"Bundeswehreinsatz in Afghanistan (2014)",TRUE,NA,NA,NA,"Verteidigung",NA,NA
1070,"Ablehnung von Schiedsgerichten bei TTIP und CETA",FALSE,NA,NA,NA,"Verbraucherschutz",NA,NA
1068,"Nationale Ausnahmeregelungen zu den EU-Richtlinien beim Anbau von Gentechnik",TRUE,NA,NA,NA,"Landwirtschaft und Ernährung","Umwelt",NA
1057,"Angleichung der Renten in Ostdeutschland an Westniveau",FALSE,NA,NA,NA,"Senioren","Deutsche Einheit / Innerdeutsche Beziehungen (bis 1990)","Soziale Sicherung"
1056,"Abschaffung der sachgrundlosen Befristung von Arbeitsverträgen",FALSE,"Ausschuss für Arbeit und Soziales",NA,NA,"Arbeit und Beschäftigung","Recht","Soziale Sicherung"
1055,"Entfall der Optionspflicht im Staatsangehörigkeitsgesetz",TRUE,NA,NA,NA,"Migration und Aufenthaltsrecht","Gesellschaftspolitik, soziale Gruppen","Recht"
1053,"Verlängerung der Bundeswehrbeteiligung an UN-Mission in Mali (Unterstützungsmission) (2014)",TRUE,NA,NA,NA,"Außenpolitik und internationale Beziehungen",NA,NA
1052,"Flächendeckender Mindestlohn von 8,50 Euro",TRUE,NA,NA,NA,"Arbeit und Beschäftigung","Soziale Sicherung",NA
1051,"Fortsetzung des Libanon-Einsatzes (UNFIL) (2014)",TRUE,NA,NA,NA,"Verteidigung",NA,NA
1046,"Rentenpaket",TRUE,NA,NA,NA,"Senioren",NA,NA
1045,"Kündigung der Atom-Abkommen mit Indien und Brasilien",FALSE,NA,NA,NA,"Energie","Verbraucherschutz",NA
1042,"Mindestlohn in der Fleischwirtschaft",TRUE,NA,NA,NA,"Arbeit und Beschäftigung","Wirtschaft",NA
1040,"Beteiligung der Bundeswehr bei Vernichtung syrischer Chemiewaffen",TRUE,NA,NA,NA,"Außenpolitik und internationale Beziehungen","Verteidigung",NA
1039,"Beteiligung der Bundeswehr an EUFOR-Einsatz Zentralafrika",TRUE,NA,NA,NA,"Verteidigung",NA,NA
1014,"Diätenerhöhung 2014",TRUE,NA,NA,NA,"Bundestag",NA,NA
1013,"Gesetz zur Strafbarkeit von Abgeordnetenbestechung",TRUE,NA,NA,NA,"Bundestag","Politisches Leben, Parteien","Recht"
1012,"Verlängerung des Bundeswehreinsatzes in Mali (2014)",TRUE,NA,NA,NA,"Außenpolitik und internationale Beziehungen",NA,NA
1009,"Anbau von Genmais in der EU verhindern",FALSE,NA,NA,NA,"Landwirtschaft und Ernährung","Umwelt",NA
1008,"Verlängerung des Anti-Terror-Einsatzes im Mittelmeer (OAE) (2013)",TRUE,NA,NA,NA,"Außenpolitik und internationale Beziehungen",NA,NA
1007,"Fortsetzung des Patriot-Einsatzes in der Türkei (2013)",TRUE,NA,NA,NA,"Verteidigung",NA,NA
1004,"Verlängerung des Bundeswehreinsatzes in Südsudan (UNMISS) (2013)",TRUE,NA,NA,NA,"Außenpolitik und internationale Beziehungen","Entwicklungspolitik",NA
953,"Deutsche Beteiligung an Ausbildungsmission in Somalia",TRUE,NA,NA,NA,"Verteidigung",NA,NA
865,"Stärkung der Unabhängigkeit der Datenschutzaufsicht",TRUE,NA,NA,NA,"Europapolitik und Europäische Union","Medien, Kommunikation und Informationstechnik","Recht"
